{
  "finding_id": "AIVSS-ASI02-001",
  "risk_category": "ASI02",
  "title": "Agent misuses legitimate tool for unauthorized data export",
  "summary": "A compromised or misled agent invokes an authorized tool outside its intended scope.",
  "cvss_vector": "CVSS:4.0/AV:N/AC:L/AT:N/PR:L/UI:N/VC:H/VI:H/VA:N/SC:H/SI:N/SA:N/E:P",
  "aivss_vector": "AIVSS:1.0/LC:I/CP:N/AP:C/SR:R/EX:M/PT:M/CA:M/TD:L",
  "publicly_exposed": true,
  "automatable": true,
  "technical_impact": "total",
  "evidence": {
    "poc": true
  },
  "path_id": "AIVSS-ASI02-001-PATH-1",
  "agentic_applicability": {
    "model_directed_goal_pursuit": true,
    "action_selection_or_sequencing": true,
    "rationale": "The synthetic fixture uses a model to pursue a delegated goal and select or sequence actions that affect its environment.",
    "evidence_refs": [
      "fixture://AIVSS-ASI02-001/agentic-applicability"
    ]
  },
  "publicly_exposed_source": "synthetic deployment inventory fixture",
  "decision_data_observed_at": "2026-08-27T00:00:00Z",
  "metric_evidence": {
    "LC": {
      "rationale": "Synthetic reference fact for AIVSS-ASI02-001: Attacker-controlled language enters through retrieved or ingested content (documents, web pages, email, files) and influences security-relevant behaviour.",
      "evidence_refs": [
        "fixture://AIVSS-ASI02-001/lc"
      ]
    },
    "CP": {
      "rationale": "Synthetic reference fact for AIVSS-ASI02-001: Single-turn or stateless; no attacker-controlled context or memory carryover between requests.",
      "evidence_refs": [
        "fixture://AIVSS-ASI02-001/cp"
      ]
    },
    "AP": {
      "rationale": "Synthetic reference fact for AIVSS-ASI02-001: Propagation occurs within the agent's own tool and action scope but does not cross a trust boundary.",
      "evidence_refs": [
        "fixture://AIVSS-ASI02-001/ap"
      ]
    },
    "SR": {
      "rationale": "Synthetic reference fact for AIVSS-ASI02-001: A production-equivalent fixture records 30 successful independent episodes out of 30, each from clean state with the hard production budget of three attempts for one stable principal; the one-sided 95% Wilson lower bound is 0.917.",
      "evidence_refs": [
        "fixture://AIVSS-ASI02-001/sr"
      ],
      "method": "empirical",
      "successes": 30,
      "episodes": 30,
      "retry_budget": 3,
      "production_equivalent": true,
      "budget_enforced": true,
      "independent": true,
      "lower_bound": 0.9172621864014352,
      "upper_bound": 1.0
    },
    "EX": {
      "rationale": "Synthetic reference fact for AIVSS-ASI02-001: One or more vetted extensions are fixed and allowlisted, with schema-validated arguments and least-privilege credentials enforced outside model output.",
      "evidence_refs": [
        "fixture://AIVSS-ASI02-001/ex"
      ]
    },
    "PT": {
      "rationale": "Synthetic reference fact for AIVSS-ASI02-001: Synthetic provider ref-provider and deployment model-ref-v1 are fixed under config-ref-v1 and changes are auditable, but provider-side artifact contents cannot be verified at runtime.",
      "evidence_refs": [
        "fixture://AIVSS-ASI02-001/pt"
      ]
    },
    "CA": {
      "rationale": "Synthetic reference fact for AIVSS-ASI02-001: A finite hard request ceiling is enforced, but its aggregate coverage across a stable principal and tenant is incomplete.",
      "evidence_refs": [
        "fixture://AIVSS-ASI02-001/ca"
      ],
      "ceiling_defined": true,
      "coverage_complete": false,
      "fail_closed": true,
      "bypass_demonstrated": false
    },
    "TD": {
      "rationale": "Synthetic reference fact for AIVSS-ASI02-001: A retrieval exercise verifies all required correlated, integrity-protected, and retained records.",
      "evidence_refs": [
        "fixture://AIVSS-ASI02-001/td"
      ],
      "retrieval_tested": true,
      "ordered_actions_reconstructable": true,
      "affected_principals_bounded": true,
      "required_fields_complete": true,
      "integrity_protected": true,
      "retention_verified": true
    }
  },
  "include_decision": true,
  "include_priority": false,
  "provenance": {
    "assessor": "synthetic-reference-fixture",
    "assessor_kind": "imported",
    "tool": "aivss-calc",
    "tool_version": "1.0.0",
    "assessed_at": "2026-08-27T00:00:00Z"
  }
}
