{
  "finding_id": "AIVSS-ASI09-001",
  "risk_category": "ASI09",
  "title": "Social engineering of human approver via forged agent summaries",
  "summary": "Attacker exploits human trust in agent-generated summaries to obtain unauthorized approvals.",
  "cvss_vector": "CVSS:4.0/AV:N/AC:L/AT:N/PR:N/UI:P/VC:L/VI:H/VA:N/SC:H/SI:N/SA:N/E:P",
  "aivss_vector": "AIVSS:1.0/LC:D/CP:N/AP:C/SR:P/EX:N/PT:L/CA:N/TD:H",
  "publicly_exposed": true,
  "automatable": false,
  "technical_impact": "partial",
  "evidence": {
    "poc": true
  },
  "path_id": "AIVSS-ASI09-001-PATH-1",
  "agentic_applicability": {
    "model_directed_goal_pursuit": true,
    "action_selection_or_sequencing": true,
    "rationale": "The synthetic fixture uses a model to pursue a delegated goal and select or sequence actions that affect its environment.",
    "evidence_refs": [
      "fixture://AIVSS-ASI09-001/agentic-applicability"
    ]
  },
  "publicly_exposed_source": "synthetic deployment inventory fixture",
  "decision_data_observed_at": "2026-08-27T00:00:00Z",
  "metric_evidence": {
    "LC": {
      "rationale": "Synthetic reference fact for AIVSS-ASI09-001: Attacker-supplied natural language reaches a privileged decision or tool-invocation path without mediation.",
      "evidence_refs": [
        "fixture://AIVSS-ASI09-001/lc"
      ]
    },
    "CP": {
      "rationale": "Synthetic reference fact for AIVSS-ASI09-001: Single-turn or stateless; no attacker-controlled context or memory carryover between requests.",
      "evidence_refs": [
        "fixture://AIVSS-ASI09-001/cp"
      ]
    },
    "AP": {
      "rationale": "Synthetic reference fact for AIVSS-ASI09-001: Propagation occurs within the agent's own tool and action scope but does not cross a trust boundary.",
      "evidence_refs": [
        "fixture://AIVSS-ASI09-001/ap"
      ]
    },
    "SR": {
      "rationale": "Synthetic reference fact for AIVSS-ASI09-001: A production-equivalent fixture records 18 successful independent episodes out of 30, each from clean state with the hard production budget of three attempts for one stable principal; one-sided 95% Wilson bounds are 0.451 and 0.733.",
      "evidence_refs": [
        "fixture://AIVSS-ASI09-001/sr"
      ],
      "method": "empirical",
      "successes": 18,
      "episodes": 30,
      "retry_budget": 3,
      "production_equivalent": true,
      "budget_enforced": true,
      "independent": true,
      "lower_bound": 0.450568396605209,
      "upper_bound": 0.7328840406750781
    },
    "EX": {
      "rationale": "Synthetic reference fact for AIVSS-ASI09-001: No security-relevant extensions on the exploitation path \u2014 read-only responses, fixed deterministic actions, or no tool/skill/MCP/plugin/workflow invocation.",
      "evidence_refs": [
        "fixture://AIVSS-ASI09-001/ex"
      ]
    },
    "PT": {
      "rationale": "Synthetic reference fact for AIVSS-ASI09-001: Synthetic provider ref-provider, model-ref-v1, and config-ref-v1 are enforced; artifact digest sha256:synthetic is verified and changes require recorded authorization.",
      "evidence_refs": [
        "fixture://AIVSS-ASI09-001/pt"
      ]
    },
    "CA": {
      "rationale": "Synthetic reference fact for AIVSS-ASI09-001: Tested fail-closed principal and tenant ceilings bound tokens, paid calls, queued work, fan-out, retries, and concurrency.",
      "evidence_refs": [
        "fixture://AIVSS-ASI09-001/ca"
      ],
      "ceiling_defined": true,
      "coverage_complete": true,
      "fail_closed": true,
      "bypass_demonstrated": false
    },
    "TD": {
      "rationale": "Synthetic reference fact for AIVSS-ASI09-001: A retrieval test cannot reconstruct ordered actions or bound affected principals.",
      "evidence_refs": [
        "fixture://AIVSS-ASI09-001/td"
      ],
      "retrieval_tested": true,
      "ordered_actions_reconstructable": false,
      "affected_principals_bounded": false,
      "required_fields_complete": false,
      "integrity_protected": false,
      "retention_verified": false
    }
  },
  "include_decision": true,
  "include_priority": false,
  "provenance": {
    "assessor": "synthetic-reference-fixture",
    "assessor_kind": "imported",
    "tool": "aivss-calc",
    "tool_version": "1.0.0",
    "assessed_at": "2026-08-27T00:00:00Z"
  }
}
