{
  "finding_id": "AIVSS-ASI08-001",
  "risk_category": "ASI08",
  "title": "Faulty planner triggers cascading downstream task failures",
  "summary": "A single agent fault propagates through orchestration to many dependent workflows.",
  "cvss_vector": "CVSS:4.0/AV:N/AC:L/AT:P/PR:N/UI:N/VC:N/VI:H/VA:H/SC:H/SI:H/SA:L/E:P",
  "aivss_vector": "AIVSS:1.0/LC:I/CP:S/AP:L/SR:P/EX:W/PT:M/CA:W/TD:H",
  "publicly_exposed": true,
  "automatable": false,
  "technical_impact": "total",
  "evidence": {
    "poc": true
  },
  "path_id": "AIVSS-ASI08-001-PATH-1",
  "agentic_applicability": {
    "model_directed_goal_pursuit": true,
    "action_selection_or_sequencing": true,
    "rationale": "The synthetic fixture uses a model to pursue a delegated goal and select or sequence actions that affect its environment.",
    "evidence_refs": [
      "fixture://AIVSS-ASI08-001/agentic-applicability"
    ]
  },
  "publicly_exposed_source": "synthetic deployment inventory fixture",
  "decision_data_observed_at": "2026-08-27T00:00:00Z",
  "metric_evidence": {
    "LC": {
      "rationale": "Synthetic reference fact for AIVSS-ASI08-001: Attacker-controlled language enters through retrieved or ingested content (documents, web pages, email, files) and influences security-relevant behaviour.",
      "evidence_refs": [
        "fixture://AIVSS-ASI08-001/lc"
      ]
    },
    "CP": {
      "rationale": "Synthetic reference fact for AIVSS-ASI08-001: Attacker-controlled context persists only in ephemeral session state (conversation buffer, in-memory working context, session-scoped cache), and testing confirms it is unreachable after the session boundary.",
      "evidence_refs": [
        "fixture://AIVSS-ASI08-001/cp"
      ]
    },
    "AP": {
      "rationale": "Synthetic reference fact for AIVSS-ASI08-001: Compromised intent, instructions, memory, or authority crosses a trust boundary to other agents, other tenants, or downstream systems.",
      "evidence_refs": [
        "fixture://AIVSS-ASI08-001/ap"
      ]
    },
    "SR": {
      "rationale": "Synthetic reference fact for AIVSS-ASI08-001: A production-equivalent fixture records 18 successful independent episodes out of 30, each from clean state with the hard production budget of three attempts for one stable principal; one-sided 95% Wilson bounds are 0.451 and 0.733.",
      "evidence_refs": [
        "fixture://AIVSS-ASI08-001/sr"
      ],
      "method": "empirical",
      "successes": 18,
      "episodes": 30,
      "retry_budget": 3,
      "production_equivalent": true,
      "budget_enforced": true,
      "independent": true,
      "lower_bound": 0.450568396605209,
      "upper_bound": 0.7328840406750781
    },
    "EX": {
      "rationale": "Synthetic reference fact for AIVSS-ASI08-001: A reachable extension is dynamic or unvetted, or its identity, callable operations, arguments, credentials, or authority are not independently constrained for the assessed deployment.",
      "evidence_refs": [
        "fixture://AIVSS-ASI08-001/ex"
      ]
    },
    "PT": {
      "rationale": "Synthetic reference fact for AIVSS-ASI08-001: Synthetic provider ref-provider and deployment model-ref-v1 are fixed under config-ref-v1 and changes are auditable, but provider-side artifact contents cannot be verified at runtime.",
      "evidence_refs": [
        "fixture://AIVSS-ASI08-001/pt"
      ]
    },
    "CA": {
      "rationale": "Synthetic reference fact for AIVSS-ASI08-001: No finite hard aggregate pre-execution ceiling exists for all attacker-reachable billable resources.",
      "evidence_refs": [
        "fixture://AIVSS-ASI08-001/ca"
      ],
      "ceiling_defined": false,
      "coverage_complete": false,
      "fail_closed": false,
      "bypass_demonstrated": false
    },
    "TD": {
      "rationale": "Synthetic reference fact for AIVSS-ASI08-001: A retrieval test cannot reconstruct ordered actions or bound affected principals.",
      "evidence_refs": [
        "fixture://AIVSS-ASI08-001/td"
      ],
      "retrieval_tested": true,
      "ordered_actions_reconstructable": false,
      "affected_principals_bounded": false,
      "required_fields_complete": false,
      "integrity_protected": false,
      "retention_verified": false
    }
  },
  "include_decision": true,
  "include_priority": false,
  "provenance": {
    "assessor": "synthetic-reference-fixture",
    "assessor_kind": "imported",
    "tool": "aivss-calc",
    "tool_version": "1.0.1",
    "assessed_at": "2026-08-27T00:00:00Z"
  }
}
