{
  "finding_id": "AIVSS-ASI04-001",
  "risk_category": "ASI04",
  "title": "Compromised MCP plugin supplies malicious tool definitions",
  "summary": "Untrusted supply-chain component alters agent capabilities or tool schemas at runtime.",
  "cvss_vector": "CVSS:4.0/AV:N/AC:H/AT:N/PR:N/UI:N/VC:H/VI:H/VA:N/SC:H/SI:L/SA:N/E:P",
  "aivss_vector": "AIVSS:1.0/LC:I/CP:N/AP:L/SR:P/EX:W/PT:H/CA:M/TD:M",
  "publicly_exposed": true,
  "automatable": false,
  "technical_impact": "total",
  "evidence": {
    "poc": true
  },
  "path_id": "AIVSS-ASI04-001-PATH-1",
  "agentic_applicability": {
    "model_directed_goal_pursuit": true,
    "action_selection_or_sequencing": true,
    "rationale": "The synthetic fixture uses a model to pursue a delegated goal and select or sequence actions that affect its environment.",
    "evidence_refs": [
      "fixture://AIVSS-ASI04-001/agentic-applicability"
    ]
  },
  "publicly_exposed_source": "synthetic deployment inventory fixture",
  "decision_data_observed_at": "2026-08-27T00:00:00Z",
  "metric_evidence": {
    "LC": {
      "rationale": "Synthetic reference fact for AIVSS-ASI04-001: Attacker-controlled language enters through retrieved or ingested content (documents, web pages, email, files) and influences security-relevant behaviour.",
      "evidence_refs": [
        "fixture://AIVSS-ASI04-001/lc"
      ]
    },
    "CP": {
      "rationale": "Synthetic reference fact for AIVSS-ASI04-001: Single-turn or stateless; no attacker-controlled context or memory carryover between requests.",
      "evidence_refs": [
        "fixture://AIVSS-ASI04-001/cp"
      ]
    },
    "AP": {
      "rationale": "Synthetic reference fact for AIVSS-ASI04-001: Compromised intent, instructions, memory, or authority crosses a trust boundary to other agents, other tenants, or downstream systems.",
      "evidence_refs": [
        "fixture://AIVSS-ASI04-001/ap"
      ]
    },
    "SR": {
      "rationale": "Synthetic reference fact for AIVSS-ASI04-001: A production-equivalent fixture records 18 successful independent episodes out of 30, each from clean state with the hard production budget of three attempts for one stable principal; one-sided 95% Wilson bounds are 0.451 and 0.733.",
      "evidence_refs": [
        "fixture://AIVSS-ASI04-001/sr"
      ],
      "method": "empirical",
      "successes": 18,
      "episodes": 30,
      "retry_budget": 3,
      "production_equivalent": true,
      "budget_enforced": true,
      "independent": true,
      "lower_bound": 0.450568396605209,
      "upper_bound": 0.7328840406750781
    },
    "EX": {
      "rationale": "Synthetic reference fact for AIVSS-ASI04-001: A reachable extension is dynamic or unvetted, or its identity, callable operations, arguments, credentials, or authority are not independently constrained for the assessed deployment.",
      "evidence_refs": [
        "fixture://AIVSS-ASI04-001/ex"
      ]
    },
    "PT": {
      "rationale": "Synthetic reference fact for AIVSS-ASI04-001: Runtime routing can select an unapproved provider and unpinned model, so no enforceable provider/model identifier or artifact integrity claim exists for this path.",
      "evidence_refs": [
        "fixture://AIVSS-ASI04-001/pt"
      ]
    },
    "CA": {
      "rationale": "Synthetic reference fact for AIVSS-ASI04-001: A finite hard request ceiling is enforced, but its aggregate coverage across a stable principal and tenant is incomplete.",
      "evidence_refs": [
        "fixture://AIVSS-ASI04-001/ca"
      ],
      "ceiling_defined": true,
      "coverage_complete": false,
      "fail_closed": true,
      "bypass_demonstrated": false
    },
    "TD": {
      "rationale": "Synthetic reference fact for AIVSS-ASI04-001: A retrieval test reconstructs ordered actions and principals but finds missing integrity or retention evidence.",
      "evidence_refs": [
        "fixture://AIVSS-ASI04-001/td"
      ],
      "retrieval_tested": true,
      "ordered_actions_reconstructable": true,
      "affected_principals_bounded": true,
      "required_fields_complete": false,
      "integrity_protected": false,
      "retention_verified": false
    }
  },
  "include_decision": true,
  "include_priority": false,
  "provenance": {
    "assessor": "synthetic-reference-fixture",
    "assessor_kind": "imported",
    "tool": "aivss-calc",
    "tool_version": "1.0.0",
    "assessed_at": "2026-08-27T00:00:00Z"
  }
}
