{
  "finding_id": "AIVSS-ASI07-001",
  "risk_category": "ASI07",
  "title": "Unsigned agent-to-agent messages allow instruction relay",
  "summary": "Inter-agent messages lack authentication, enabling cross-agent propagation of malicious intent.",
  "cvss_vector": "CVSS:4.0/AV:A/AC:L/AT:N/PR:N/UI:N/VC:L/VI:H/VA:N/SC:H/SI:L/SA:N/E:P",
  "aivss_vector": "AIVSS:1.0/LC:I/CP:S/AP:L/SR:R/EX:W/PT:H/CA:M/TD:M",
  "publicly_exposed": false,
  "automatable": true,
  "technical_impact": "total",
  "evidence": {
    "poc": true
  },
  "path_id": "AIVSS-ASI07-001-PATH-1",
  "agentic_applicability": {
    "model_directed_goal_pursuit": true,
    "action_selection_or_sequencing": true,
    "rationale": "The synthetic fixture uses a model to pursue a delegated goal and select or sequence actions that affect its environment.",
    "evidence_refs": [
      "fixture://AIVSS-ASI07-001/agentic-applicability"
    ]
  },
  "publicly_exposed_source": "synthetic deployment inventory fixture",
  "decision_data_observed_at": "2026-08-27T00:00:00Z",
  "metric_evidence": {
    "LC": {
      "rationale": "Synthetic reference fact for AIVSS-ASI07-001: Attacker-controlled language enters through retrieved or ingested content (documents, web pages, email, files) and influences security-relevant behaviour.",
      "evidence_refs": [
        "fixture://AIVSS-ASI07-001/lc"
      ]
    },
    "CP": {
      "rationale": "Synthetic reference fact for AIVSS-ASI07-001: Attacker-controlled context persists only in ephemeral session state (conversation buffer, in-memory working context, session-scoped cache), and testing confirms it is unreachable after the session boundary.",
      "evidence_refs": [
        "fixture://AIVSS-ASI07-001/cp"
      ]
    },
    "AP": {
      "rationale": "Synthetic reference fact for AIVSS-ASI07-001: Compromised intent, instructions, memory, or authority crosses a trust boundary to other agents, other tenants, or downstream systems.",
      "evidence_refs": [
        "fixture://AIVSS-ASI07-001/ap"
      ]
    },
    "SR": {
      "rationale": "Synthetic reference fact for AIVSS-ASI07-001: A production-equivalent fixture records 30 successful independent episodes out of 30, each from clean state with the hard production budget of three attempts for one stable principal; the one-sided 95% Wilson lower bound is 0.917.",
      "evidence_refs": [
        "fixture://AIVSS-ASI07-001/sr"
      ],
      "method": "empirical",
      "successes": 30,
      "episodes": 30,
      "retry_budget": 3,
      "production_equivalent": true,
      "budget_enforced": true,
      "independent": true,
      "lower_bound": 0.9172621864014352,
      "upper_bound": 1.0
    },
    "EX": {
      "rationale": "Synthetic reference fact for AIVSS-ASI07-001: A reachable extension is dynamic or unvetted, or its identity, callable operations, arguments, credentials, or authority are not independently constrained for the assessed deployment.",
      "evidence_refs": [
        "fixture://AIVSS-ASI07-001/ex"
      ]
    },
    "PT": {
      "rationale": "Synthetic reference fact for AIVSS-ASI07-001: Runtime routing can select an unapproved provider and unpinned model, so no enforceable provider/model identifier or artifact integrity claim exists for this path.",
      "evidence_refs": [
        "fixture://AIVSS-ASI07-001/pt"
      ]
    },
    "CA": {
      "rationale": "Synthetic reference fact for AIVSS-ASI07-001: A finite hard request ceiling is enforced, but its aggregate coverage across a stable principal and tenant is incomplete.",
      "evidence_refs": [
        "fixture://AIVSS-ASI07-001/ca"
      ],
      "ceiling_defined": true,
      "coverage_complete": false,
      "fail_closed": true,
      "bypass_demonstrated": false
    },
    "TD": {
      "rationale": "Synthetic reference fact for AIVSS-ASI07-001: A retrieval test reconstructs ordered actions and principals but finds missing integrity or retention evidence.",
      "evidence_refs": [
        "fixture://AIVSS-ASI07-001/td"
      ],
      "retrieval_tested": true,
      "ordered_actions_reconstructable": true,
      "affected_principals_bounded": true,
      "required_fields_complete": false,
      "integrity_protected": false,
      "retention_verified": false
    }
  },
  "include_decision": true,
  "include_priority": false,
  "provenance": {
    "assessor": "synthetic-reference-fixture",
    "assessor_kind": "imported",
    "tool": "aivss-calc",
    "tool_version": "1.0.1",
    "assessed_at": "2026-08-27T00:00:00Z"
  }
}
